{"https://godaddy.com": {"data": {"0": {"link-0": {"SPOTLIGHT": {"COMMITMENT": {"OTHER": {"we": {"text": {"we": [{"0": "We use GoDaddy for our business website as well as commerce/payment processing.  We get lots of complements on our website which we built in about an hour using a GoDaddy template.  We also use their commerce payment processing and it is the BEST!  Lowest fees, no per-transaction fee, and the Poynt terminal is so easy to use and dependable."}, {"1": "We switched to Godaddy from our\u2026"}, {"2": "We switched to Godaddy from our previous provider and we could not be more pleased. They offer a vast product line to help you meet whatever your goals are. The customer service is by far the best. Im so glad we switched"}, {"3": "82+ million domains, 20+ million\u00a0customers, millions of websites, email and security \u2014 we help grow businesses."}, {"4": "We love to help. Call us for award-winning support, 1-480-366-3546."}, {"5": "How can we help?"}, {"6": "We recognize several core privacy rights for all individuals: "}, {"7": "the right to know what personal data we hold about you"}]}, "count": 8}, "promise": {"text": {}, "count": 0}, "only": {"text": {"only": [{"0": "This notice does not apply when our customers or another person processes personal data for their own benefit. For example, when a customer sends email for their own business purposes that includes personal data, the customer is acting as the \u201ccontroller\u201d. When our customer acts as the controller, we act as the \u201cprocessor\u201d and process personal data only in accordance with our customer's instructions or as required by law."}, {"1": "We may revise this global privacy notice by posting a revised statement at the same location as this Notice, on another location on our website, or by contacting customers directly.  If we change this global privacy notice, it will apply to personal data collected prior to adoption of the new statement only to the extent as the new statement does not reduce the rights of affected data subjects."}]}, "count": 2}}}, "SUGGESTIVE": {"OTHER": {"other": {"text": {"other": [{"0": "This Global Privacy Notice describes the core privacy practices of GoDaddy Operating Company, LLC and certain of its subsidiaries, affiliates and brands, including GoDaddy.com, LLC, Afternic.com, Inc., Blue Razor Domains, LLC, CallCatchers, Inc. d/b/a Freedom Voice, GoDaddy Payments, LLC, GoDaddy Media Temple, LLC d/b/a Sucuri, GoDaddy Sellbrite, Inc., Lantirn, Inc. d/b/a re:Amaze, Pagely, LLC, and Poynt, LLC (collectively herein, \u201cGoDaddy\u201d) and applies to all individuals regardless of where they live. Other GoDaddy companies maintain separate privacy policies and procedures, notices of which are available on those companies\u2019 websites and/or mobile applications. We also maintain customized local privacy notices for certain jurisdictions with unique privacy notice requirements, which can be access through the following links: "}, {"1": "United States (California and other States)"}, {"2": "This notice does not apply when our customers or another person processes personal data for their own benefit. For example, when a customer sends email for their own business purposes that includes personal data, the customer is acting as the \u201ccontroller\u201d. When our customer acts as the controller, we act as the \u201cprocessor\u201d and process personal data only in accordance with our customer's instructions or as required by law."}, {"3": "If we do not honor a request for legal or other reasons, we will explain why we did not honor the request, the right to appeal, and any right to file a complaint (if available where the requestor lives). "}, {"4": "Personal Data Individuals ProvideWe collect personal data when a customer or another person sets up an account, uses our services, or contacts us.  Examples of personal data we may collect include a person's name, email address, phone number, physical address, and payment method.   \n"}, {"5": "Personal Data We Collect AutomaticallyWe collect personal data automatically when you visit our websites, use our services, contact us, open our emails, or view our advertising.  Examples of personal data we may collect include your device ID, your IP address, information about web pages and other websites you visit, and other similar details. "}, {"6": "Personal Data from Other Sources"}, {"7": "Detecting DNS abuse, fraud and other illegal activity"}, {"8": "Other uses consistent with the purposes for which the personal data was collected or provided to us"}, {"9": "We do not sell, lease, rent, or transfer personal data to third parties for monetary or other consideration.  "}, {"10": "to processors to operate our business and provide services, including but not limited to providing security services, payment processing and customer support; conducting contests and surveys; generating data insights; and performing other activities related to our business and services.   \n"}, {"11": "to comply with law enforcement and other legal requests, protect our legal rights, prevent harm to us or others, and enforce our policies and contracts. "}, {"12": "Cookies, Web Beacons, and Other Online Identifiers"}, {"13": "Cookies are text files placed on a device when a person visits our webpages or view messages from us.  Some cookies are \u201csession cookies\u201d that expire at the end of a browser session, while others are \u201cpersistent cookies\u201d that allow us to remember user preferences and settings over multiple visits and across other websites. "}, {"14": "We manage some identifiers directly.  Other identifiers are managed by third parties.  For example, we use Google Analytics to monitor website performance and visitor engagement.   \n"}, {"15": "We use optional and mandatory identifiers. Optional identifiers are used for support, website performance, and advertising. Mandatory identifiers are used for account, verification, service continuity, security, and other essential functions necessary to provide our website and services."}, {"16": "\"Do Not Track\" and other Preference Signals"}, {"17": "Please see our European Data Protection Disclosures for more information regarding the other transfer mechanisms we use to transfer personal data from the EU/EEA, Switzerland, and the UK. "}, {"18": "We retain personal data for our business needs and to comply with law.  If we no longer need personal data, we may delete it or de-identify it so that it no longer identifies a specific person.  Factors we consider when deciding when to delete or de-identify your personal data include: (1) if you still have an account, (2) if we are required to retain personal data to comply with law, or (3) if the personal data is needed for tax other business purposes."}, {"19": "We process personal data upon a person's request, with a person's consent, to fulfill our contracts, based on our legitimate interest, or other lawful bases. The specific basis of processing depends on the services you are using, the data being processed, the place where the processing occurs, and the place where you live. If you have questions about our basis for processing your personal data, please contact us at privacy@godaddy.com."}, {"20": "We may revise this global privacy notice by posting a revised statement at the same location as this Notice, on another location on our website, or by contacting customers directly.  If we change this global privacy notice, it will apply to personal data collected prior to adoption of the new statement only to the extent as the new statement does not reduce the rights of affected data subjects."}, {"21": "Copyright \u00a9 1999 - 2024 GoDaddy Operating Company, LLC. All Rights Reserved.\u00a0The GoDaddy word mark is a registered trademark of GoDaddy Operating Company, LLC in the US and other countries. The \u201cGO\u201d logo is a registered trademark of GoDaddy.com, LLC in the US."}]}, "count": 22}}}, "CONDITIONAL": {"OTHER": {"if": {"text": {"if": [{"0": "We encourage you to review your local customized notice if you live in one of these areas.   "}, {"1": "We also manually review requests to exercise privacy rights where self-service is not possible or appropriate. We promptly review such requests to exercise privacy rights.  If we need more information to process a request, we will contact the requestor by email or, if we do not have an email address on file for the requestor, by the same method the request was made.   \n"}, {"2": "If we do not honor a request for legal or other reasons, we will explain why we did not honor the request, the right to appeal, and any right to file a complaint (if available where the requestor lives). "}, {"3": "in addition, if we sell some or all of our assets or merge with a third-party we may transfer relevant personal data to the buyer or new company.  "}, {"4": "Web Beacons are image files placed in our web pages and emails that we use for such purposes as determining if an email has been opened or an advertisement has been viewed."}, {"5": "In addition to our Manage Privacy Settings options, many web browsers allow users to block cookies (directly or through plugins and extensions). Some cookies, however, are essential for our website and services to function.  If you set your browser to block all cookies, you may not be able to use our services."}, {"6": "If you are a customer, through your Account Settings"}, {"7": "We retain personal data for our business needs and to comply with law.  If we no longer need personal data, we may delete it or de-identify it so that it no longer identifies a specific person.  Factors we consider when deciding when to delete or de-identify your personal data include: (1) if you still have an account, (2) if we are required to retain personal data to comply with law, or (3) if the personal data is needed for tax other business purposes."}, {"8": "We do not knowingly collect personal data about anyone under 18 without permission from their legal guardian.  Please contact us at privacy@godaddy.com if you believe we have collected information from a child without permission from their legal guardian. "}, {"9": "We process personal data upon a person's request, with a person's consent, to fulfill our contracts, based on our legitimate interest, or other lawful bases. The specific basis of processing depends on the services you are using, the data being processed, the place where the processing occurs, and the place where you live. If you have questions about our basis for processing your personal data, please contact us at privacy@godaddy.com."}, {"10": "We may revise this global privacy notice by posting a revised statement at the same location as this Notice, on another location on our website, or by contacting customers directly.  If we change this global privacy notice, it will apply to personal data collected prior to adoption of the new statement only to the extent as the new statement does not reduce the rights of affected data subjects."}, {"11": "If you have any questions, you can contact us at privacy@godaddy.com or by mail at:"}]}, "count": 12}, "when": {"text": {"when": [{"0": "GoDaddy empowers entrepreneurs everywhere, making opportunity more inclusive for all. We also empower you to manage your privacy preferences and exercise your privacy rights when visiting our website, using our services, and communicating with us.   \n"}, {"1": "This global privacy notice covers personal data when we act as the data controller."}, {"2": "We act as a controller when we process personal data for our own use. For example, we act as a controller when you provide your personal data to open an account."}, {"3": "This notice does not apply when our customers or another person processes personal data for their own benefit. For example, when a customer sends email for their own business purposes that includes personal data, the customer is acting as the \u201ccontroller\u201d. When our customer acts as the controller, we act as the \u201cprocessor\u201d and process personal data only in accordance with our customer's instructions or as required by law."}, {"4": "Personal Data Individuals ProvideWe collect personal data when a customer or another person sets up an account, uses our services, or contacts us.  Examples of personal data we may collect include a person's name, email address, phone number, physical address, and payment method.   \n"}, {"5": "Personal Data We Collect AutomaticallyWe collect personal data automatically when you visit our websites, use our services, contact us, open our emails, or view our advertising.  Examples of personal data we may collect include your device ID, your IP address, information about web pages and other websites you visit, and other similar details. "}, {"6": "Cookies are text files placed on a device when a person visits our webpages or view messages from us.  Some cookies are \u201csession cookies\u201d that expire at the end of a browser session, while others are \u201cpersistent cookies\u201d that allow us to remember user preferences and settings over multiple visits and across other websites. "}, {"7": "We transfer personal data internationally to operate our business and provide services.  We comply with applicable law when making international transfers."}, {"8": "We retain personal data for our business needs and to comply with law.  If we no longer need personal data, we may delete it or de-identify it so that it no longer identifies a specific person.  Factors we consider when deciding when to delete or de-identify your personal data include: (1) if you still have an account, (2) if we are required to retain personal data to comply with law, or (3) if the personal data is needed for tax other business purposes."}]}, "count": 9}}}, "BENEFIT": {"OTHER": {"help you": {"text": {}, "count": 0}, "help us": {"text": {"help us": [{"0": "Scripts are small pieces of computer code that power customer service tools, deliver video, provide interactive experiences, and help us measure service use. "}]}, "count": 1}}}, "ACCESS": {"OTHER": {"can access": {"text": {}, "count": 0}, "can't access": {"text": {}, "count": 0}}}}, "CAPABILITY": {"COMPANY": {"ASSERTIVE": {"we will not": {"text": {"we will not": [{"0": "We will not discriminate against you for exercising your privacy rights.   \n"}]}, "count": 1}, "we only": {"text": {}, "count": 0}, "we collect": {"text": {"we collect": [{"0": "Personal Data Individuals ProvideWe collect personal data when a customer or another person sets up an account, uses our services, or contacts us.  Examples of personal data we may collect include a person's name, email address, phone number, physical address, and payment method.   \n"}, {"1": "Personal Data We Collect Automatically"}]}, "count": 2}, "we collect information": {"text": {}, "count": 0}, "we collect details": {"text": {}, "count": 0}, "we don't share information that": {"text": {}, "count": 0}}, "PASSIVE": {"we collect certain": {"text": {}, "count": 0}, "we may collect": {"text": {"we may collect": [{"0": "Personal Data Individuals ProvideWe collect personal data when a customer or another person sets up an account, uses our services, or contacts us.  Examples of personal data we may collect include a person's name, email address, phone number, physical address, and payment method.   \n"}, {"1": "Personal Data We Collect AutomaticallyWe collect personal data automatically when you visit our websites, use our services, contact us, open our emails, or view our advertising.  Examples of personal data we may collect include your device ID, your IP address, information about web pages and other websites you visit, and other similar details. "}, {"2": "Personal Data from Other SourcesWe may collect personal data  about you from other sources.  Examples of personal data obtained from other sources include publicly available data, social media information, and information lawfully gathered by third party data providers. "}]}, "count": 3}, "we may collect certain": {"text": {}, "count": 0}, "we gather data": {"text": {}, "count": 0}, "we may disclose": {"text": {}, "count": 0}}}, "USER": {"OTHER": {"you may": {"text": {"you may": [{"0": "In addition to our Manage Privacy Settings options, many web browsers allow users to block cookies (directly or through plugins and extensions). Some cookies, however, are essential for our website and services to function.  If you set your browser to block all cookies, you may not be able to use our services."}]}, "count": 1}, "you can": {"text": {"you can": [{"0": "you can always reach us at privacy@godaddy.com or by mail at the addresses listed in Contact Us to exercise your privacy rights. "}, {"1": "You can manage your marketing and advertising preferences, including whether you wish to receive customized marketing and advertising:  \n"}, {"2": "If you have any questions, you can contact us at privacy@godaddy.com or by mail at:"}]}, "count": 3}, "right to request": {"text": {}, "count": 0}, "your choice": {"text": {}, "count": 0}, "request access": {"text": {}, "count": 0}}, "MODIFICATION": {"deletion of": {"text": {}, "count": 0}, "delete": {"text": {"delete": [{"0": "the right to access, correct, or delete your personal data "}, {"1": "We retain personal data for our business needs and to comply with law.  If we no longer need personal data, we may delete it or de-identify it so that it no longer identifies a specific person.  Factors we consider when deciding when to delete or de-identify your personal data include: (1) if you still have an account, (2) if we are required to retain personal data to comply with law, or (3) if the personal data is needed for tax other business purposes."}]}, "count": 2}, "remove": {"text": {}, "count": 0}, "removal": {"text": {}, "count": 0}, "erase": {"text": {}, "count": 0}}}}, "LEGAL": {"BINDING": {"OTHER": {"contract": {"text": {}, "count": 0}, "contractual": {"text": {}, "count": 0}, "agreement": {"text": {}, "count": 0}, "obligation": {"text": {}, "count": 0}}}, "NOTICE": {"OTHER": {"we have the right": {"text": {}, "count": 0}, "you control": {"text": {}, "count": 0}, "we control": {"text": {}, "count": 0}, "rights": {"text": {"rights": [{"0": "GoDaddy empowers entrepreneurs everywhere, making opportunity more inclusive for all. We also empower you to manage your privacy preferences and exercise your privacy rights when visiting our website, using our services, and communicating with us.   \n"}, {"1": "you can always reach us at privacy@godaddy.com or by mail at the addresses listed in Contact Us to exercise your privacy rights. "}, {"2": "We recognize several core privacy rights for all individuals: "}, {"3": "Where technically feasible and appropriate, we provide self-service and automated mechanisms to allow individuals to exercise their privacy rights. "}, {"4": "We also manually review requests to exercise privacy rights where self-service is not possible or appropriate. We promptly review such requests to exercise privacy rights.  If we need more information to process a request, we will contact the requestor by email or, if we do not have an email address on file for the requestor, by the same method the request was made.   \n"}, {"5": "to comply with law enforcement and other legal requests, protect our legal rights, prevent harm to us or others, and enforce our policies and contracts. "}, {"6": "We will not discriminate against you for exercising your privacy rights.   \n"}, {"7": "We may revise this global privacy notice by posting a revised statement at the same location as this Notice, on another location on our website, or by contacting customers directly.  If we change this global privacy notice, it will apply to personal data collected prior to adoption of the new statement only to the extent as the new statement does not reduce the rights of affected data subjects."}, {"8": "Copyright \u00a9 1999 - 2024 GoDaddy Operating Company, LLC. All Rights Reserved.\u00a0The GoDaddy word mark is a registered trademark of GoDaddy Operating Company, LLC in the US and other countries. The \u201cGO\u201d logo is a registered trademark of GoDaddy.com, LLC in the US."}]}, "count": 9}, "right to know": {"text": {"right to know": [{"0": "the right to know what personal data we hold about you"}]}, "count": 1}, "information may be disclosed": {"text": {}, "count": 0}}}, "LEGISLATIVE": {"LAW": {"legal": {"text": {"legal": [{"0": "If we do not honor a request for legal or other reasons, we will explain why we did not honor the request, the right to appeal, and any right to file a complaint (if available where the requestor lives). "}, {"1": "Detecting DNS abuse, fraud and other illegal activity"}, {"2": "to comply with law enforcement and other legal requests, protect our legal rights, prevent harm to us or others, and enforce our policies and contracts. "}, {"3": "We do not knowingly collect personal data about anyone under 18 without permission from their legal guardian.  Please contact us at privacy@godaddy.com if you believe we have collected information from a child without permission from their legal guardian. "}, {"4": "Legal Basis for Processing "}, {"5": "United Kingdom: Attn: Legal, Office of the Data Privacy Officer, 5th Floor, The Shipping Building, Old Vinyl Factory, 252-254 Blyth Road, Hayes, UB3 1HA."}, {"6": "European Union (EEA) / Switzerland: Attn: Legal, Office of the Data Privacy Officer, GoDaddy c/o WeWork, Friesenplatz 4, 50672 K\u00f6ln, Germany"}]}, "count": 7}, "authority": {"text": {}, "count": 0}, "comply with": {"text": {"comply with": [{"0": "to comply with law enforcement and other legal requests, protect our legal rights, prevent harm to us or others, and enforce our policies and contracts. "}, {"1": "We transfer personal data internationally to operate our business and provide services.  We comply with applicable law when making international transfers."}, {"2": "We retain personal data for our business needs and to comply with law.  If we no longer need personal data, we may delete it or de-identify it so that it no longer identifies a specific person.  Factors we consider when deciding when to delete or de-identify your personal data include: (1) if you still have an account, (2) if we are required to retain personal data to comply with law, or (3) if the personal data is needed for tax other business purposes."}]}, "count": 3}, "compliant with": {"text": {}, "count": 0}, "law": {"text": {"law": [{"0": "This notice does not apply when our customers or another person processes personal data for their own benefit. For example, when a customer sends email for their own business purposes that includes personal data, the customer is acting as the \u201ccontroller\u201d. When our customer acts as the controller, we act as the \u201cprocessor\u201d and process personal data only in accordance with our customer's instructions or as required by law."}, {"1": "to comply with law enforcement and other legal requests, protect our legal rights, prevent harm to us or others, and enforce our policies and contracts. "}, {"2": "We recognize universal opt-out mechanisms, such as the Global Privacy Control, where required by applicable law.  "}, {"3": "We transfer personal data internationally to operate our business and provide services.  We comply with applicable law when making international transfers."}, {"4": "We retain personal data for our business needs and to comply with law.  If we no longer need personal data, we may delete it or de-identify it so that it no longer identifies a specific person.  Factors we consider when deciding when to delete or de-identify your personal data include: (1) if you still have an account, (2) if we are required to retain personal data to comply with law, or (3) if the personal data is needed for tax other business purposes."}]}, "count": 5}, "enforce": {"text": {"enforce": [{"0": "to comply with law enforcement and other legal requests, protect our legal rights, prevent harm to us or others, and enforce our policies and contracts. "}]}, "count": 1}, "govern": {"text": {}, "count": 0}, "regulators": {"text": {}, "count": 0}, "privacy law": {"text": {}, "count": 0}, "policy": {"text": {"policy": [{"0": "Policy Changes"}, {"1": "\n    \n\n\n\n\n\nLegalAgreementsPrivacy Policy\n\n\n  "}]}, "count": 2}, "state laws": {"text": {}, "count": 0}, "international laws": {"text": {}, "count": 0}, "in accordane with": {"text": {}, "count": 0}}, "CALIFORNIA": {"california": {"text": {"california": [{"0": "United States (California and other States)"}]}, "count": 1}, "other than california": {"text": {}, "count": 0}, "outside of california": {"text": {}, "count": 0}}, "YOUTH": {"children": {"text": {"children": [{"0": "\n  \n    GoDaddy - Global Privacy Notice\n  \n    \n      Last Revised: 7/1/2024\n    \n\n      To view our archived Privacy Notice, click here.\nGoDaddy empowers entrepreneurs everywhere, making opportunity more inclusive for all. We also empower you to manage your privacy preferences and exercise your privacy rights when visiting our website, using our services, and communicating with us.   \n\nAs described below,  \n\n\nwebsite visitors can manage their privacy preferences by visiting Manage Privacy Settings \ncustomers can manage their privacy preferences in their Account Settings page, and \nyou can always reach us at privacy@godaddy.com or by mail at the addresses listed in Contact Us to exercise your privacy rights. \n\nThis Global Privacy Notice describes the core privacy practices of GoDaddy Operating Company, LLC and certain of its subsidiaries, affiliates and brands, including GoDaddy.com, LLC, Afternic.com, Inc., Blue Razor Domains, LLC, CallCatchers, Inc. d/b/a Freedom Voice, GoDaddy Payments, LLC, GoDaddy Media Temple, LLC d/b/a Sucuri, GoDaddy Sellbrite, Inc., Lantirn, Inc. d/b/a re:Amaze, Pagely, LLC, and Poynt, LLC (collectively herein, \u201cGoDaddy\u201d) and applies to all individuals regardless of where they live. Other GoDaddy companies maintain separate privacy policies and procedures, notices of which are available on those companies\u2019 websites and/or mobile applications. We also maintain customized local privacy notices for certain jurisdictions with unique privacy notice requirements, which can be access through the following links: \n\nAustralia\nCanada\nEurope (EU/EEA, UK, and Switzerland)\nUnited States (California and other States)\n\nWe encourage you to review your local customized notice if you live in one of these areas.   \n\n        Data Covered by this Privacy Notice\n\n      This global privacy notice covers personal data when we act as the data controller.\n\nPersonal data includes data that identifies or could be used to identify a specific person, and any data about that person. For example, your name, address, and payment details are personal data.\nWe act as a controller when we process personal data for our own use. For example, we act as a controller when you provide your personal data to open an account.\n\nThis notice does not apply when our customers or another person processes personal data for their own benefit. For example, when a customer sends email for their own business purposes that includes personal data, the customer is acting as the \u201ccontroller\u201d. When our customer acts as the controller, we act as the \u201cprocessor\u201d and process personal data only in accordance with our customer's instructions or as required by law.\nThis notice does not apply to third-party applications offered through our services or linked through our website, such as Microsoft 365 and similar offerings. For information about the privacy practices of any third-party offerings, please review the privacy notice applicable to that offering before using it.\n\n        Core Privacy Rights\n\n  We recognize several core privacy rights for all individuals: \n\nthe right to know what personal data we hold about you\nthe right to access, correct, or delete your personal data \nthe right to transfer your personal data (data portability)\nthe right to set your individual marketing and advertising preferences  \n\n\nWhere technically feasible and appropriate, we provide self-service and automated mechanisms to allow individuals to exercise their privacy rights. \nWe also manually review requests to exercise privacy rights where self-service is not possible or appropriate. We promptly review such requests to exercise privacy rights.  If we need more information to process a request, we will contact the requestor by email or, if we do not have an email address on file for the requestor, by the same method the request was made.   \n\nIf we do not honor a request for legal or other reasons, we will explain why we did not honor the request, the right to appeal, and any right to file a complaint (if available where the requestor lives). \n\n        PII We Collect\n\n  \n\nPersonal Data Individuals ProvideWe collect personal data when a customer or another person sets up an account, uses our services, or contacts us.  Examples of personal data we may collect include a person's name, email address, phone number, physical address, and payment method.   \n\n\n\nPersonal Data We Collect AutomaticallyWe collect personal data automatically when you visit our websites, use our services, contact us, open our emails, or view our advertising.  Examples of personal data we may collect include your device ID, your IP address, information about web pages and other websites you visit, and other similar details. \n\n\nPersonal Data from Other SourcesWe may collect personal data  about you from other sources.  Examples of personal data obtained from other sources include publicly available data, social media information, and information lawfully gathered by third party data providers. \n\n\nPersonal Data We GenerateWe process data in connection with our business and services to generate inferences and insights that may be linked to a specific person, including through the use of data analytics and artificial intelligence.\n\n\n\n        Use of Personal Data\n\n  We use personal data to operate and improve our business and services.  Examples of how we use personal data include:  \n\n\nManaging customer accounts\nProcessing purchase requests\nRegistering domains\nProvisioning products and services\nProviding customer support\nSecuring, updating, and improving our services\nDetecting DNS abuse, fraud and other illegal activity\nMarketing and advertising of our services\nContacting customers, prospective customers, and others by telephone, text or messaging applications to offer you our services\nWebsite traffic measurement\nOther uses consistent with the purposes for which the personal data was collected or provided to us\n\n\n        No Sale of Personal Data\n\n  \nWe do not sell, lease, rent, or transfer personal data to third parties for monetary or other consideration.  \n\n        Disclosures to Others\n\n  We disclose personal data: \n\nto processors to operate our business and provide services, including but not limited to providing security services, payment processing and customer support; conducting contests and surveys; generating data insights; and performing other activities related to our business and services.   \n\nto business partners to offer some services, such as email and payment processing.   \n\nto marketers and advertisers, including for the purpose of creating and delivering personalized marketing and advertising messages.   \n\nto comply with law enforcement and other legal requests, protect our legal rights, prevent harm to us or others, and enforce our policies and contracts. \nin addition, if we sell some or all of our assets or merge with a third-party we may transfer relevant personal data to the buyer or new company.  \n\n\n        Cookies, Web Beacons, and Other Online Identifiers\n\n  We use three main types of online identifiers on our website and in our services: cookies, web beacons, and scripts.    \n\n\nCookies are text files placed on a device when a person visits our webpages or view messages from us.  Some cookies are \u201csession cookies\u201d that expire at the end of a browser session, while others are \u201cpersistent cookies\u201d that allow us to remember user preferences and settings over multiple visits and across other websites. \nWeb Beacons are image files placed in our web pages and emails that we use for such purposes as determining if an email has been opened or an advertisement has been viewed.\nScripts are small pieces of computer code that power customer service tools, deliver video, provide interactive experiences, and help us measure service use. \n\nWe manage some identifiers directly.  Other identifiers are managed by third parties.  For example, we use Google Analytics to monitor website performance and visitor engagement.   \n\nWe use identifiers to provide customized services, measure website performance, provide customer support, deliver personalized advertising, and generate data insights, including through the use of artificial intelligence. Specific examples of how we use identifiers include, but are not limited to: \n\nSetting your service preferences \nManaging your shopping cart \nGuarding against fraud  \n\nDelivering relevant advertisements \nMeasuring website use \nConducting research on use of product featuresto improve our services \n\n\n        Identifier Management\n\n  We use optional and mandatory identifiers. Optional identifiers are used for support, website performance, and advertising. Mandatory identifiers are used for account, verification, service continuity, security, and other essential functions necessary to provide our website and services.\nWe offer several methods for managing optional identifier settings.  Individuals using our websites can manage identifier settings by clicking on Manage Privacy Settings through the link in this notice. Customers can also manage their identifier settings for our websites and our services through their customer account settings. We do not offer the ability to manage mandatory identifiers, because such identifiers are essential to providing our products and services.\nIn addition to our Manage Privacy Settings options, many web browsers allow users to block cookies (directly or through plugins and extensions). Some cookies, however, are essential for our website and services to function.  If you set your browser to block all cookies, you may not be able to use our services.\n\n        \"Do Not Track\" and other Preference Signals\n\n  Some web browsers provide a \u201cDo Not Track\u201d feature.  There are no generally accepted standards for this feature and we do not respond to \u201cDo Not Track\u201d signals.\nWe recognize universal opt-out mechanisms, such as the Global Privacy Control, where required by applicable law.  \n\n        Marketing and Advertising Preferences \n\n      You can manage your marketing and advertising preferences, including whether you wish to receive customized marketing and advertising:  \n\n\nThrough this notice by clicking Manage Privacy Settings\nIf you are a customer, through your Account Settings\n\n\n        Storage\n\n  \nWe store personal data on our own systems and with trusted service providers, including Amazon Web Services.   \n\n        International Transfers\n\n  \nWe transfer personal data internationally to operate our business and provide services.  We comply with applicable law when making international transfers.\nFor transfers of personal data from the European Union/European Economic Area, Switzerland, and the United Kingdom, we have certified our compliance with the EU-U.S. Data Privacy Framework (\u201cEU-U.S. DPF), the Swiss-U.S. Data Privacy Framework, and the UK Extension to the EU-U.S. DPF, collectively (the \u201cDPF\u201d).  Please see our Data Privacy Framework Notice for more information on our participation in the DPF Program. \nPlease see our European Data Protection Disclosures for more information regarding the other transfer mechanisms we use to transfer personal data from the EU/EEA, Switzerland, and the UK. \nPlease see our Australian and Canadian supplemental privacy notices for information on international data transfers from those countries.\n\n        Length of Retention\n\n  \nWe retain personal data for our business needs and to comply with law.  If we no longer need personal data, we may delete it or de-identify it so that it no longer identifies a specific person.  Factors we consider when deciding when to delete or de-identify your personal data include: (1) if you still have an account, (2) if we are required to retain personal data to comply with law, or (3) if the personal data is needed for tax other business purposes.\n\n        Security\n\n  \nWe use risk-based measures to protect personal data, including appropriate security controls and employee training.  We also require that our service providers, business partners, and advertisers use appropriate risk-based controls to protect personal data.   \n\n        No Collection of Personal Data about Children\n\n      \nWe do not knowingly collect personal data about anyone under 18 without permission from their legal guardian.  Please contact us at privacy@godaddy.com if you believe we have collected information from a child without permission from their legal guardian. \n\n        Legal Basis for Processing \n\n      \nWe process personal data upon a person's request, with a person's consent, to fulfill our contracts, based on our legitimate interest, or other lawful bases. The specific basis of processing depends on the services you are using, the data being processed, the place where the processing occurs, and the place where you live. If you have questions about our basis for processing your personal data, please contact us at privacy@godaddy.com.\n\n        Non-Discrimination\n\n  \nWe will not discriminate against you for exercising your privacy rights.   \n\n\n        No Financial Incentives\n\n  \nWe do not provide any financial incentives for providing personal data to us.\n\n        Policy Changes\n\n  \nWe may revise this global privacy notice by posting a revised statement at the same location as this Notice, on another location on our website, or by contacting customers directly.  If we change this global privacy notice, it will apply to personal data collected prior to adoption of the new statement only to the extent as the new statement does not reduce the rights of affected data subjects.\n\n        Contact Us\n\n  If you have any questions, you can contact us at privacy@godaddy.com or by mail at:\n\nUnited States: Attn: Office of the Data Privacy Officer, 100 S. Mill Ave, Suite 1600, Tempe, AZ 85281 USA\nUnited Kingdom: Attn: Legal, Office of the Data Privacy Officer, 5th Floor, The Shipping Building, Old Vinyl Factory, 252-254 Blyth Road, Hayes, UB3 1HA.\nEuropean Union (EEA) / Switzerland: Attn: Legal, Office of the Data Privacy Officer, GoDaddy c/o WeWork, Friesenplatz 4, 50672 K\u00f6ln, Germany\nAsia: Attn: Office of the Data Privacy Officer, 80 Robinson Road #02-00 Singapore 068898\n\nWe respond to all questions or concerns within 30 days.\n\n"}]}, "count": 1}, "kid": {"text": {}, "count": 0}, "child": {"text": {"child": [{"0": "We do not knowingly collect personal data about anyone under 18 without permission from their legal guardian.  Please contact us at privacy@godaddy.com if you believe we have collected information from a child without permission from their legal guardian. "}]}, "count": 1}, "youth": {"text": {}, "count": 0}, "young": {"text": {}, "count": 0}, "minor": {"text": {}, "count": 0}, "under the age": {"text": {}, "count": 0}, "under age": {"text": {}, "count": 0}}}, "PREPPING": {"OTHER": {"consent": {"text": {"consent": [{"0": "We process personal data upon a person's request, with a person's consent, to fulfill our contracts, based on our legitimate interest, or other lawful bases. The specific basis of processing depends on the services you are using, the data being processed, the place where the processing occurs, and the place where you live. If you have questions about our basis for processing your personal data, please contact us at privacy@godaddy.com."}]}, "count": 1}, "dispute": {"text": {}, "count": 0}, "with your consent": {"text": {}, "count": 0}, "does not cover": {"text": {}, "count": 0}}, "ASSERTION": {"you consented": {"text": {}, "count": 0}, "you consent": {"text": {}, "count": 0}, "you agree": {"text": {"you agree": [{"0": "Use of this Site is subject to express terms of use. By using this site, you signify that you agree to be bound by these Universal Terms of Service."}]}, "count": 1}, "your agreement": {"text": {}, "count": 0}, "you acknowledge": {"text": {}, "count": 0}, "you acknowledged": {"text": {}, "count": 0}, "you signed": {"text": {}, "count": 0}, "you approve": {"text": {}, "count": 0}, "you approved": {"text": {}, "count": 0}, "with your permission": {"text": {}, "count": 0}, "you made it public": {"text": {}, "count": 0}, "you oblige": {"text": {}, "count": 0}, "you obliged": {"text": {}, "count": 0}, "you chose": {"text": {}, "count": 0}, "you choose": {"text": {}, "count": 0}, "when you signed": {"text": {}, "count": 0}, "when you accepted": {"text": {}, "count": 0}, "when you read": {"text": {}, "count": 0}, "when you approved": {"text": {}, "count": 0}, "when you consent": {"text": {}, "count": 0}, "when you acknowledge": {"text": {}, "count": 0}}}}, "BUSINESS_FOCUS": {"EXTERNAL": {"OTHER": {"third parties": {"text": {"third parties": [{"0": "We do not sell, lease, rent, or transfer personal data to third parties for monetary or other consideration.  "}, {"1": "We manage some identifiers directly.  Other identifiers are managed by third parties.  For example, we use Google Analytics to monitor website performance and visitor engagement.   \n"}]}, "count": 2}, "third-party": {"text": {"third-party": [{"0": "This notice does not apply to third-party applications offered through our services or linked through our website, such as Microsoft 365 and similar offerings. For information about the privacy practices of any third-party offerings, please review the privacy notice applicable to that offering before using it."}, {"1": "in addition, if we sell some or all of our assets or merge with a third-party we may transfer relevant personal data to the buyer or new company.  "}]}, "count": 2}, "third party": {"text": {"third party": [{"0": "Personal Data from Other SourcesWe may collect personal data  about you from other sources.  Examples of personal data obtained from other sources include publicly available data, social media information, and information lawfully gathered by third party data providers. "}]}, "count": 1}, "advertising partners": {"text": {}, "count": 0}}, "ASSERTIVE": {"we send to third": {"text": {}, "count": 0}, "we sell to third": {"text": {}, "count": 0}, "we share with third": {"text": {}, "count": 0}, "we exchange with third": {"text": {}, "count": 0}}, "PASSIVE": {"may send to third": {"text": {}, "count": 0}, "may sell to third": {"text": {}, "count": 0}, "may share with third": {"text": {}, "count": 0}, "may exchange with third": {"text": {}, "count": 0}}}, "SELF": {"PASSIVE": {"may share information": {"text": {}, "count": 0}, "may share": {"text": {}, "count": 0}}, "ASSERTIVE": {"we share": {"text": {}, "count": 0}, "we sell": {"text": {"we sell": [{"0": "in addition, if we sell some or all of our assets or merge with a third-party we may transfer relevant personal data to the buyer or new company.  "}]}, "count": 1}}, "OTHER": {"business goals": {"text": {}, "count": 0}, "business purposes": {"text": {"business purposes": [{"0": "This notice does not apply when our customers or another person processes personal data for their own benefit. For example, when a customer sends email for their own business purposes that includes personal data, the customer is acting as the \u201ccontroller\u201d. When our customer acts as the controller, we act as the \u201cprocessor\u201d and process personal data only in accordance with our customer's instructions or as required by law."}, {"1": "We retain personal data for our business needs and to comply with law.  If we no longer need personal data, we may delete it or de-identify it so that it no longer identifies a specific person.  Factors we consider when deciding when to delete or de-identify your personal data include: (1) if you still have an account, (2) if we are required to retain personal data to comply with law, or (3) if the personal data is needed for tax other business purposes."}]}, "count": 2}, "enterprise": {"text": {}, "count": 0}}}, "AMBITION": {"OTHER": {"to improve": {"text": {"to improve": [{"0": "Conducting research on use of product featuresto improve our services "}]}, "count": 1}, "to optimize": {"text": {}, "count": 0}, "to increase": {"text": {}, "count": 0}, "to benefit our": {"text": {}, "count": 0}, "to enhance our": {"text": {}, "count": 0}, "to enhance": {"text": {}, "count": 0}, "to innovate": {"text": {}, "count": 0}, "technologial innovation": {"text": {}, "count": 0}}}}, "ATTRIBUTING": {"USER": {"OTHER": {"information you": {"text": {}, "count": 0}, "a profile": {"text": {}, "count": 0}, "your activity": {"text": {}, "count": 0}, "user behavior": {"text": {}, "count": 0}, "personl records": {"text": {}, "count": 0}, "personal records": {"text": {}, "count": 0}}, "ASSERTIVE": {"we create a user profile": {"text": {}, "count": 0}, "create a user profile": {"text": {}, "count": 0}, "we profile": {"text": {}, "count": 0}, "owns your data": {"text": {}, "count": 0}}}, "LOCATION": {"OTHER": {"location information": {"text": {}, "count": 0}, "location": {"text": {"location": [{"0": "We may revise this global privacy notice by posting a revised statement at the same location as this Notice, on another location on our website, or by contacting customers directly.  If we change this global privacy notice, it will apply to personal data collected prior to adoption of the new statement only to the extent as the new statement does not reduce the rights of affected data subjects."}]}, "count": 1}, "location data": {"text": {}, "count": 0}}}, "DATA": {"OTHER": {"usage": {"text": {}, "count": 0}, "records": {"text": {}, "count": 0}}}}, "UTILIZATION": {"USE": {"OTHER": {"to gather data": {"text": {}, "count": 0}, "data controller": {"text": {"data controller": [{"0": "This global privacy notice covers personal data when we act as the data controller."}]}, "count": 1}}, "ASSERTIVE": {"we process": {"text": {"we process": [{"0": "We act as a controller when we process personal data for our own use. For example, we act as a controller when you provide your personal data to open an account."}, {"1": "Personal Data We GenerateWe process data in connection with our business and services to generate inferences and insights that may be linked to a specific person, including through the use of data analytics and artificial intelligence."}, {"2": "We process personal data upon a person's request, with a person's consent, to fulfill our contracts, based on our legitimate interest, or other lawful bases. The specific basis of processing depends on the services you are using, the data being processed, the place where the processing occurs, and the place where you live. If you have questions about our basis for processing your personal data, please contact us at privacy@godaddy.com."}]}, "count": 3}, "we use": {"text": {"we use": [{"0": "We use personal data to operate and improve our business and services.  Examples of how we use personal data include:  \n"}, {"1": "We use three main types of online identifiers on our website and in our services: cookies, web beacons, and scripts.    \n"}, {"2": "Web Beacons are image files placed in our web pages and emails that we use for such purposes as determining if an email has been opened or an advertisement has been viewed."}, {"3": "We manage some identifiers directly.  Other identifiers are managed by third parties.  For example, we use Google Analytics to monitor website performance and visitor engagement.   \n"}, {"4": "We use identifiers to provide customized services, measure website performance, provide customer support, deliver personalized advertising, and generate data insights, including through the use of artificial intelligence. Specific examples of how we use identifiers include, but are not limited to: "}, {"5": "We use optional and mandatory identifiers. Optional identifiers are used for support, website performance, and advertising. Mandatory identifiers are used for account, verification, service continuity, security, and other essential functions necessary to provide our website and services."}, {"6": "Please see our European Data Protection Disclosures for more information regarding the other transfer mechanisms we use to transfer personal data from the EU/EEA, Switzerland, and the UK. "}, {"7": "We use risk-based measures to protect personal data, including appropriate security controls and employee training.  We also require that our service providers, business partners, and advertisers use appropriate risk-based controls to protect personal data.   "}]}, "count": 8}}, "PASSIVE": {"may use information": {"text": {}, "count": 0}}}, "NON_EXCLUSIVE": {"ASSERTIVE": {"we sell information": {"text": {}, "count": 0}}, "OTHER": {"sharing of": {"text": {}, "count": 0}, "sharing of personal": {"text": {}, "count": 0}, "sharing of user": {"text": {}, "count": 0}, "external processing": {"text": {}, "count": 0}}}, "PERSISTENCE": {"OTHER": {"data collected": {"text": {"data collected": [{"0": "We may revise this global privacy notice by posting a revised statement at the same location as this Notice, on another location on our website, or by contacting customers directly.  If we change this global privacy notice, it will apply to personal data collected prior to adoption of the new statement only to the extent as the new statement does not reduce the rights of affected data subjects."}]}, "count": 1}, "collected": {"text": {"collected": [{"0": "Other uses consistent with the purposes for which the personal data was collected or provided to us"}, {"1": "We do not knowingly collect personal data about anyone under 18 without permission from their legal guardian.  Please contact us at privacy@godaddy.com if you believe we have collected information from a child without permission from their legal guardian. "}, {"2": "We may revise this global privacy notice by posting a revised statement at the same location as this Notice, on another location on our website, or by contacting customers directly.  If we change this global privacy notice, it will apply to personal data collected prior to adoption of the new statement only to the extent as the new statement does not reduce the rights of affected data subjects."}]}, "count": 3}, "stored": {"text": {}, "count": 0}, "retention": {"text": {"retention": [{"0": "\n  \n    GoDaddy - Global Privacy Notice\n  \n    \n      Last Revised: 7/1/2024\n    \n\n      To view our archived Privacy Notice, click here.\nGoDaddy empowers entrepreneurs everywhere, making opportunity more inclusive for all. We also empower you to manage your privacy preferences and exercise your privacy rights when visiting our website, using our services, and communicating with us.   \n\nAs described below,  \n\n\nwebsite visitors can manage their privacy preferences by visiting Manage Privacy Settings \ncustomers can manage their privacy preferences in their Account Settings page, and \nyou can always reach us at privacy@godaddy.com or by mail at the addresses listed in Contact Us to exercise your privacy rights. \n\nThis Global Privacy Notice describes the core privacy practices of GoDaddy Operating Company, LLC and certain of its subsidiaries, affiliates and brands, including GoDaddy.com, LLC, Afternic.com, Inc., Blue Razor Domains, LLC, CallCatchers, Inc. d/b/a Freedom Voice, GoDaddy Payments, LLC, GoDaddy Media Temple, LLC d/b/a Sucuri, GoDaddy Sellbrite, Inc., Lantirn, Inc. d/b/a re:Amaze, Pagely, LLC, and Poynt, LLC (collectively herein, \u201cGoDaddy\u201d) and applies to all individuals regardless of where they live. Other GoDaddy companies maintain separate privacy policies and procedures, notices of which are available on those companies\u2019 websites and/or mobile applications. We also maintain customized local privacy notices for certain jurisdictions with unique privacy notice requirements, which can be access through the following links: \n\nAustralia\nCanada\nEurope (EU/EEA, UK, and Switzerland)\nUnited States (California and other States)\n\nWe encourage you to review your local customized notice if you live in one of these areas.   \n\n        Data Covered by this Privacy Notice\n\n      This global privacy notice covers personal data when we act as the data controller.\n\nPersonal data includes data that identifies or could be used to identify a specific person, and any data about that person. For example, your name, address, and payment details are personal data.\nWe act as a controller when we process personal data for our own use. For example, we act as a controller when you provide your personal data to open an account.\n\nThis notice does not apply when our customers or another person processes personal data for their own benefit. For example, when a customer sends email for their own business purposes that includes personal data, the customer is acting as the \u201ccontroller\u201d. When our customer acts as the controller, we act as the \u201cprocessor\u201d and process personal data only in accordance with our customer's instructions or as required by law.\nThis notice does not apply to third-party applications offered through our services or linked through our website, such as Microsoft 365 and similar offerings. For information about the privacy practices of any third-party offerings, please review the privacy notice applicable to that offering before using it.\n\n        Core Privacy Rights\n\n  We recognize several core privacy rights for all individuals: \n\nthe right to know what personal data we hold about you\nthe right to access, correct, or delete your personal data \nthe right to transfer your personal data (data portability)\nthe right to set your individual marketing and advertising preferences  \n\n\nWhere technically feasible and appropriate, we provide self-service and automated mechanisms to allow individuals to exercise their privacy rights. \nWe also manually review requests to exercise privacy rights where self-service is not possible or appropriate. We promptly review such requests to exercise privacy rights.  If we need more information to process a request, we will contact the requestor by email or, if we do not have an email address on file for the requestor, by the same method the request was made.   \n\nIf we do not honor a request for legal or other reasons, we will explain why we did not honor the request, the right to appeal, and any right to file a complaint (if available where the requestor lives). \n\n        PII We Collect\n\n  \n\nPersonal Data Individuals ProvideWe collect personal data when a customer or another person sets up an account, uses our services, or contacts us.  Examples of personal data we may collect include a person's name, email address, phone number, physical address, and payment method.   \n\n\n\nPersonal Data We Collect AutomaticallyWe collect personal data automatically when you visit our websites, use our services, contact us, open our emails, or view our advertising.  Examples of personal data we may collect include your device ID, your IP address, information about web pages and other websites you visit, and other similar details. \n\n\nPersonal Data from Other SourcesWe may collect personal data  about you from other sources.  Examples of personal data obtained from other sources include publicly available data, social media information, and information lawfully gathered by third party data providers. \n\n\nPersonal Data We GenerateWe process data in connection with our business and services to generate inferences and insights that may be linked to a specific person, including through the use of data analytics and artificial intelligence.\n\n\n\n        Use of Personal Data\n\n  We use personal data to operate and improve our business and services.  Examples of how we use personal data include:  \n\n\nManaging customer accounts\nProcessing purchase requests\nRegistering domains\nProvisioning products and services\nProviding customer support\nSecuring, updating, and improving our services\nDetecting DNS abuse, fraud and other illegal activity\nMarketing and advertising of our services\nContacting customers, prospective customers, and others by telephone, text or messaging applications to offer you our services\nWebsite traffic measurement\nOther uses consistent with the purposes for which the personal data was collected or provided to us\n\n\n        No Sale of Personal Data\n\n  \nWe do not sell, lease, rent, or transfer personal data to third parties for monetary or other consideration.  \n\n        Disclosures to Others\n\n  We disclose personal data: \n\nto processors to operate our business and provide services, including but not limited to providing security services, payment processing and customer support; conducting contests and surveys; generating data insights; and performing other activities related to our business and services.   \n\nto business partners to offer some services, such as email and payment processing.   \n\nto marketers and advertisers, including for the purpose of creating and delivering personalized marketing and advertising messages.   \n\nto comply with law enforcement and other legal requests, protect our legal rights, prevent harm to us or others, and enforce our policies and contracts. \nin addition, if we sell some or all of our assets or merge with a third-party we may transfer relevant personal data to the buyer or new company.  \n\n\n        Cookies, Web Beacons, and Other Online Identifiers\n\n  We use three main types of online identifiers on our website and in our services: cookies, web beacons, and scripts.    \n\n\nCookies are text files placed on a device when a person visits our webpages or view messages from us.  Some cookies are \u201csession cookies\u201d that expire at the end of a browser session, while others are \u201cpersistent cookies\u201d that allow us to remember user preferences and settings over multiple visits and across other websites. \nWeb Beacons are image files placed in our web pages and emails that we use for such purposes as determining if an email has been opened or an advertisement has been viewed.\nScripts are small pieces of computer code that power customer service tools, deliver video, provide interactive experiences, and help us measure service use. \n\nWe manage some identifiers directly.  Other identifiers are managed by third parties.  For example, we use Google Analytics to monitor website performance and visitor engagement.   \n\nWe use identifiers to provide customized services, measure website performance, provide customer support, deliver personalized advertising, and generate data insights, including through the use of artificial intelligence. Specific examples of how we use identifiers include, but are not limited to: \n\nSetting your service preferences \nManaging your shopping cart \nGuarding against fraud  \n\nDelivering relevant advertisements \nMeasuring website use \nConducting research on use of product featuresto improve our services \n\n\n        Identifier Management\n\n  We use optional and mandatory identifiers. Optional identifiers are used for support, website performance, and advertising. Mandatory identifiers are used for account, verification, service continuity, security, and other essential functions necessary to provide our website and services.\nWe offer several methods for managing optional identifier settings.  Individuals using our websites can manage identifier settings by clicking on Manage Privacy Settings through the link in this notice. Customers can also manage their identifier settings for our websites and our services through their customer account settings. We do not offer the ability to manage mandatory identifiers, because such identifiers are essential to providing our products and services.\nIn addition to our Manage Privacy Settings options, many web browsers allow users to block cookies (directly or through plugins and extensions). Some cookies, however, are essential for our website and services to function.  If you set your browser to block all cookies, you may not be able to use our services.\n\n        \"Do Not Track\" and other Preference Signals\n\n  Some web browsers provide a \u201cDo Not Track\u201d feature.  There are no generally accepted standards for this feature and we do not respond to \u201cDo Not Track\u201d signals.\nWe recognize universal opt-out mechanisms, such as the Global Privacy Control, where required by applicable law.  \n\n        Marketing and Advertising Preferences \n\n      You can manage your marketing and advertising preferences, including whether you wish to receive customized marketing and advertising:  \n\n\nThrough this notice by clicking Manage Privacy Settings\nIf you are a customer, through your Account Settings\n\n\n        Storage\n\n  \nWe store personal data on our own systems and with trusted service providers, including Amazon Web Services.   \n\n        International Transfers\n\n  \nWe transfer personal data internationally to operate our business and provide services.  We comply with applicable law when making international transfers.\nFor transfers of personal data from the European Union/European Economic Area, Switzerland, and the United Kingdom, we have certified our compliance with the EU-U.S. Data Privacy Framework (\u201cEU-U.S. DPF), the Swiss-U.S. Data Privacy Framework, and the UK Extension to the EU-U.S. DPF, collectively (the \u201cDPF\u201d).  Please see our Data Privacy Framework Notice for more information on our participation in the DPF Program. \nPlease see our European Data Protection Disclosures for more information regarding the other transfer mechanisms we use to transfer personal data from the EU/EEA, Switzerland, and the UK. \nPlease see our Australian and Canadian supplemental privacy notices for information on international data transfers from those countries.\n\n        Length of Retention\n\n  \nWe retain personal data for our business needs and to comply with law.  If we no longer need personal data, we may delete it or de-identify it so that it no longer identifies a specific person.  Factors we consider when deciding when to delete or de-identify your personal data include: (1) if you still have an account, (2) if we are required to retain personal data to comply with law, or (3) if the personal data is needed for tax other business purposes.\n\n        Security\n\n  \nWe use risk-based measures to protect personal data, including appropriate security controls and employee training.  We also require that our service providers, business partners, and advertisers use appropriate risk-based controls to protect personal data.   \n\n        No Collection of Personal Data about Children\n\n      \nWe do not knowingly collect personal data about anyone under 18 without permission from their legal guardian.  Please contact us at privacy@godaddy.com if you believe we have collected information from a child without permission from their legal guardian. \n\n        Legal Basis for Processing \n\n      \nWe process personal data upon a person's request, with a person's consent, to fulfill our contracts, based on our legitimate interest, or other lawful bases. The specific basis of processing depends on the services you are using, the data being processed, the place where the processing occurs, and the place where you live. If you have questions about our basis for processing your personal data, please contact us at privacy@godaddy.com.\n\n        Non-Discrimination\n\n  \nWe will not discriminate against you for exercising your privacy rights.   \n\n\n        No Financial Incentives\n\n  \nWe do not provide any financial incentives for providing personal data to us.\n\n        Policy Changes\n\n  \nWe may revise this global privacy notice by posting a revised statement at the same location as this Notice, on another location on our website, or by contacting customers directly.  If we change this global privacy notice, it will apply to personal data collected prior to adoption of the new statement only to the extent as the new statement does not reduce the rights of affected data subjects.\n\n        Contact Us\n\n  If you have any questions, you can contact us at privacy@godaddy.com or by mail at:\n\nUnited States: Attn: Office of the Data Privacy Officer, 100 S. Mill Ave, Suite 1600, Tempe, AZ 85281 USA\nUnited Kingdom: Attn: Legal, Office of the Data Privacy Officer, 5th Floor, The Shipping Building, Old Vinyl Factory, 252-254 Blyth Road, Hayes, UB3 1HA.\nEuropean Union (EEA) / Switzerland: Attn: Legal, Office of the Data Privacy Officer, GoDaddy c/o WeWork, Friesenplatz 4, 50672 K\u00f6ln, Germany\nAsia: Attn: Office of the Data Privacy Officer, 80 Robinson Road #02-00 Singapore 068898\n\nWe respond to all questions or concerns within 30 days.\n\n"}]}, "count": 1}}}}, "INNOVATION": {"DEPTH": {"OTHER": {"analyze": {"text": {}, "count": 0}, "analysis": {"text": {}, "count": 0}, "analytics": {"text": {"analytics": [{"0": "Personal Data We GenerateWe process data in connection with our business and services to generate inferences and insights that may be linked to a specific person, including through the use of data analytics and artificial intelligence."}, {"1": "We manage some identifiers directly.  Other identifiers are managed by third parties.  For example, we use Google Analytics to monitor website performance and visitor engagement.   \n"}]}, "count": 2}}}, "AUTOMTATION": {"OTHER": {"automate": {"text": {}, "count": 0}, "automatic": {"text": {}, "count": 0}, "AI": {"text": {"AI": [{"0": "AI Powered"}, {"1": "AI-Powered"}]}, "count": 2}, "information collected automatically": {"text": {}, "count": 0}, "collected automatically": {"text": {}, "count": 0}}}, "AI": {"OTHER": {"artificial intelligence": {"text": {"artificial intelligence": [{"0": "Personal Data We GenerateWe process data in connection with our business and services to generate inferences and insights that may be linked to a specific person, including through the use of data analytics and artificial intelligence."}, {"1": "We use identifiers to provide customized services, measure website performance, provide customer support, deliver personalized advertising, and generate data insights, including through the use of artificial intelligence. Specific examples of how we use identifiers include, but are not limited to: "}]}, "count": 2}, "algorithm": {"text": {}, "count": 0}, "language processing": {"text": {}, "count": 0}}}}, "SECURITY": {"CHOICE": {"OTHER": {"control options": {"text": {}, "count": 0}, "settings": {"text": {"settings": [{"0": "website visitors can manage their privacy preferences by visiting Manage Privacy Settings "}, {"1": "customers can manage their privacy preferences in their Account Settings page, and "}, {"2": "Cookies are text files placed on a device when a person visits our webpages or view messages from us.  Some cookies are \u201csession cookies\u201d that expire at the end of a browser session, while others are \u201cpersistent cookies\u201d that allow us to remember user preferences and settings over multiple visits and across other websites. "}, {"3": "We offer several methods for managing optional identifier settings.  Individuals using our websites can manage identifier settings by clicking on Manage Privacy Settings through the link in this notice. Customers can also manage their identifier settings for our websites and our services through their customer account settings. We do not offer the ability to manage mandatory identifiers, because such identifiers are essential to providing our products and services."}, {"4": "In addition to our Manage Privacy Settings options, many web browsers allow users to block cookies (directly or through plugins and extensions). Some cookies, however, are essential for our website and services to function.  If you set your browser to block all cookies, you may not be able to use our services."}, {"5": "\nThrough this notice by clicking Manage Privacy Settings\nIf you are a customer, through your Account Settings\n"}]}, "count": 6}, "privacy controls": {"text": {}, "count": 0}, "privacy settings": {"text": {"privacy settings": [{"0": "website visitors can manage their privacy preferences by visiting Manage Privacy Settings "}, {"1": "We offer several methods for managing optional identifier settings.  Individuals using our websites can manage identifier settings by clicking on Manage Privacy Settings through the link in this notice. Customers can also manage their identifier settings for our websites and our services through their customer account settings. We do not offer the ability to manage mandatory identifiers, because such identifiers are essential to providing our products and services."}, {"2": "In addition to our Manage Privacy Settings options, many web browsers allow users to block cookies (directly or through plugins and extensions). Some cookies, however, are essential for our website and services to function.  If you set your browser to block all cookies, you may not be able to use our services."}, {"3": "\nThrough this notice by clicking Manage Privacy Settings\nIf you are a customer, through your Account Settings\n"}]}, "count": 4}}}, "INTENTION": {"OTHER": {"fraud": {"text": {"fraud": [{"0": "Detecting DNS abuse, fraud and other illegal activity"}, {"1": "Guarding against fraud  \n"}]}, "count": 2}, "detect": {"text": {}, "count": 0}, "malicious": {"text": {}, "count": 0}, "illegal activity": {"text": {"illegal activity": [{"0": "\nManaging customer accounts\nProcessing purchase requests\nRegistering domains\nProvisioning products and services\nProviding customer support\nSecuring, updating, and improving our services\nDetecting DNS abuse, fraud and other illegal activity\nMarketing and advertising of our services\nContacting customers, prospective customers, and others by telephone, text or messaging applications to offer you our services\nWebsite traffic measurement\nOther uses consistent with the purposes for which the personal data was collected or provided to us\n"}]}, "count": 1}}}, "COMMITMENT": {"OTHER": {"to protect": {"text": {"to protect": [{"0": "We use risk-based measures to protect personal data, including appropriate security controls and employee training.  We also require that our service providers, business partners, and advertisers use appropriate risk-based controls to protect personal data.   "}]}, "count": 1}, "protect personal information": {"text": {}, "count": 0}}}, "ACCESS": {"OTHER": {"encryption": {"text": {}, "count": 0}, "security": {"text": {"security": [{"0": "All Web Security Options"}, {"1": "to processors to operate our business and provide services, including but not limited to providing security services, payment processing and customer support; conducting contests and surveys; generating data insights; and performing other activities related to our business and services.   \n"}, {"2": "We use optional and mandatory identifiers. Optional identifiers are used for support, website performance, and advertising. Mandatory identifiers are used for account, verification, service continuity, security, and other essential functions necessary to provide our website and services."}, {"3": "We use risk-based measures to protect personal data, including appropriate security controls and employee training.  We also require that our service providers, business partners, and advertisers use appropriate risk-based controls to protect personal data.   "}]}, "count": 4}, "unauthorized": {"text": {}, "count": 0}, "auditing": {"text": {}, "count": 0}}}}, "EDUCATION": {"HOW": {"OTHER": {"how": {"text": {"how": [{"0": "We use personal data to operate and improve our business and services.  Examples of how we use personal data include:  \n"}, {"1": "We use identifiers to provide customized services, measure website performance, provide customer support, deliver personalized advertising, and generate data insights, including through the use of artificial intelligence. Specific examples of how we use identifiers include, but are not limited to: "}]}, "count": 2}, "how you": {"text": {}, "count": 0}, "how we": {"text": {"how we": [{"0": "We use personal data to operate and improve our business and services.  Examples of how we use personal data include:  \n"}, {"1": "We use identifiers to provide customized services, measure website performance, provide customer support, deliver personalized advertising, and generate data insights, including through the use of artificial intelligence. Specific examples of how we use identifiers include, but are not limited to: "}]}, "count": 2}, "how are": {"text": {}, "count": 0}, "how can": {"text": {}, "count": 0}}}, "OTHER": {"explain": {"text": {"explain": [{"0": "If we do not honor a request for legal or other reasons, we will explain why we did not honor the request, the right to appeal, and any right to file a complaint (if available where the requestor lives). "}]}, "count": 1}, "understand": {"text": {}, "count": 0}, "type of cookies": {"text": {}, "count": 0}, "what are": {"text": {}, "count": 0}, "learn": {"text": {}, "count": 0}, "purpose for collection": {"text": {}, "count": 0}, "if you have questions": {"text": {"if you have questions": [{"0": "We process personal data upon a person's request, with a person's consent, to fulfill our contracts, based on our legitimate interest, or other lawful bases. The specific basis of processing depends on the services you are using, the data being processed, the place where the processing occurs, and the place where you live. If you have questions about our basis for processing your personal data, please contact us at privacy@godaddy.com."}]}, "count": 1}, "if you have any questions": {"text": {"if you have any questions": [{"0": "If you have any questions, you can contact us at privacy@godaddy.com or by mail at:"}]}, "count": 1}, "related information": {"text": {}, "count": 0}, "educate": {"text": {}, "count": 0}, "education": {"text": {}, "count": 0}}}, "SUGGESTIVE": {"SUSPICIOUS": {"OTHER": {"for various reasons": {"text": {}, "count": 0}, "possibility": {"text": {}, "count": 0}, "intention": {"text": {}, "count": 0}, "certain": {"text": {"certain": [{"0": "This Global Privacy Notice describes the core privacy practices of GoDaddy Operating Company, LLC and certain of its subsidiaries, affiliates and brands, including GoDaddy.com, LLC, Afternic.com, Inc., Blue Razor Domains, LLC, CallCatchers, Inc. d/b/a Freedom Voice, GoDaddy Payments, LLC, GoDaddy Media Temple, LLC d/b/a Sucuri, GoDaddy Sellbrite, Inc., Lantirn, Inc. d/b/a re:Amaze, Pagely, LLC, and Poynt, LLC (collectively herein, \u201cGoDaddy\u201d) and applies to all individuals regardless of where they live. Other GoDaddy companies maintain separate privacy policies and procedures, notices of which are available on those companies\u2019 websites and/or mobile applications. We also maintain customized local privacy notices for certain jurisdictions with unique privacy notice requirements, which can be access through the following links: "}]}, "count": 1}, "other data": {"text": {}, "count": 0}, "other purposes": {"text": {}, "count": 0}, "other reasons": {"text": {"other reasons": [{"0": "If we do not honor a request for legal or other reasons, we will explain why we did not honor the request, the right to appeal, and any right to file a complaint (if available where the requestor lives). "}]}, "count": 1}, "other objectives": {"text": {}, "count": 0}, "various purposes": {"text": {}, "count": 0}, "various objectives": {"text": {}, "count": 0}, "if necessary": {"text": {}, "count": 0}, "for business purpose": {"text": {}, "count": 0}}}, "CONDITIONAL": {"OTHER": {"we may share": {"text": {}, "count": 0}, "for legal reasons": {"text": {}, "count": 0}, "may not cover": {"text": {}, "count": 0}, "only when": {"text": {}, "count": 0}, "only for": {"text": {}, "count": 0}, "only under": {"text": {}, "count": 0}}}}, "TECHNOLOGY": {"OTHER": {"cookies": {"text": {"cookies": [{"0": "Cookies, Web Beacons, and Other Online Identifiers"}, {"1": "We use three main types of online identifiers on our website and in our services: cookies, web beacons, and scripts.    \n"}, {"2": "Cookies are text files placed on a device when a person visits our webpages or view messages from us.  Some cookies are \u201csession cookies\u201d that expire at the end of a browser session, while others are \u201cpersistent cookies\u201d that allow us to remember user preferences and settings over multiple visits and across other websites. "}, {"3": "In addition to our Manage Privacy Settings options, many web browsers allow users to block cookies (directly or through plugins and extensions). Some cookies, however, are essential for our website and services to function.  If you set your browser to block all cookies, you may not be able to use our services."}]}, "count": 4}, "mobile identifiers": {"text": {}, "count": 0}, "pixel tags": {"text": {}, "count": 0}, "web beacons": {"text": {"web beacons": [{"0": "Cookies, Web Beacons, and Other Online Identifiers"}, {"1": "We use three main types of online identifiers on our website and in our services: cookies, web beacons, and scripts.    \n"}, {"2": "Web Beacons are image files placed in our web pages and emails that we use for such purposes as determining if an email has been opened or an advertisement has been viewed."}]}, "count": 3}, "session monitoring": {"text": {}, "count": 0}}}}}}, "entry": 1}}